,ID,comments,cleaned_comments
0,12zoi09mRoE,More twists than a piece of rope 🪢 great movie 🎥,twist piec rope great movi
1,12zoi09mRoE,"In truth, the film in Italy is called Vicolo Blindo",truth film itali call vicolo blindo
2,12zoi09mRoE,bomb,bomb
3,12zoi09mRoE,Name?,name
4,12zoi09mRoE,"Love how Patrick Wilson works against type, lending his Wholesome Good Looks to ambivalent characters like Walter",love patrick wilson work type lend wholesom good look ambival charact like walter
5,12zoi09mRoE,Een español<br>P,een espa olp
6,12zoi09mRoE,Hermoso trailler <br>En eshermoso. Trailler. Buenisimo,hermoso trailler en eshermoso trailler buenisimo
7,12zoi09mRoE,Hes an awesome actor . I know his family in Fla,he awesom actor know famili fla
8,12zoi09mRoE,Great movie...,great movi
9,12zoi09mRoE,"You cccаn&#39;t find this mоvie with beeetter quаlity than hееeеree =&gt; <a href=""https://twitter.com/fa085d5a2db6d499f/status/822794172616699906"">https://twitter.com/fa085d5a2db6d499f/status/822794172616699906</a>",ccc n find vie beeetter qu liti h e ree gt http twitter com fa db f statu
10,12zoi09mRoE,"You ссccan&#39;t find this moooviеееe with bеttеer quааaаlityууу thаn hеrе =&gt; <a href=""https://twitter.com/59b30906ab3b845b4/status/822794172616699906"">https://twitter.com/59b30906ab3b845b4/status/822794172616699906</a>",ccan find mooovi e b tt er qu liti th n h r gt http twitter com b ab b b statu
11,12zoi09mRoE,"Yоou cааn&#39;t find this movie with beeetter quаaааlityyyу than heeere =&gt; <a href=""https://twitter.com/bb170997d74a862e0/status/822794172616699906"">https://twitter.com/bb170997d74a862e0/status/822794172616699906</a>",ou c n find movi beeetter qu lityyi heeer gt http twitter com bb e statu
12,12zoi09mRoE,"I watсhеd А Kind ооf MMMurder full movie hеre <a href=""https://twitter.com/d90fec710b476d1f5/status/822794172616699906"">https://twitter.com/d90fec710b476d1f5/status/822794172616699906</a>",wat h kind f mmmurder full movi h http twitter com fec b f statu
13,12zoi09mRoE,Haley Bennett om nom nom,haley bennett om nom nom
14,12zoi09mRoE,"I found this movie quite watchable, reminded me of the old Hitchcock films.",found movi quit watchabl remind old hitchcock film
15,12zoi09mRoE,gоood,g ood
16,uzqYqoVoU74,"My only problem with the trailer is that they said it wasn’t our planet. If they said something like “the hunt has evolved”, “the hunt has changed” or “there’s new blood in the hunt” I think that would’ve been better. Still loved the movie though",problem trailer said planet said someth like hunt evolv hunt chang new blood hunt think would better still love movi though
17,uzqYqoVoU74,&quot;How do we kill them?&quot; &quot;However you can&quot;  👍👍,quot kill quot quot howev quot
18,uzqYqoVoU74,The movie was far better than the 2018 crap.,movi far better crap
19,uzqYqoVoU74,This was actually a half decent effort to recreate intensive atmostphere of the legendary first movie. The first half of the movie is actually pretty good. Then it goes downhill. Mediorce but a masterpiece compared to awful &quot;The Predator&quot;.,actual half decent effort recreat intens atmostpher legendari first movi first half movi actual pretti good goe downhil mediorc masterpiec compar aw quot predat quot
20,uzqYqoVoU74,They should of kept  going with this.  Acting was great.  Plot was great.  Every thing about this was great. Adrien Brody nailed it.,kept go act great plot great everi thing great adrien brodi nail
21,uzqYqoVoU74,Owh man,owh man
22,uzqYqoVoU74,"Definitely from all films with Predator only the original from 1987 is great. &quot;Predators&quot; is not so unique, but is average at least or quite good production. Predator 2 was not so bad neither. Both don&#39;t have that impact as the oryginal, but they can be enjoyable without desire to rewatch. Aliens vs Predator was awful the continuation much worse and when I was thinking that they can not destroy franchise more was release The Predator which is a complete disaster. Predators have some bullshit (the original also had many but with a charm) and isn&#39;t perfect with the atmosphere but at least this is Predator you know as a hunter who like challenge and this film at least sometimes can build tension. Generally if somebody wants to see more of this allien hunter misnamed as predator then he should watch Predators.",definit film predat origin great quot predat quot uniqu averag least quit good product predat bad neither impact orygin enjoy without desir rewatch alien vs predat aw continu much wors think destroy franchis releas predat complet disast predat bullshit origin also mani charm perfect atmospher least predat know hunter like challeng film least sometim build tension gener somebodi want see allien hunter misnam predat watch predat
23,uzqYqoVoU74,2010 was such a good year for Predator. This movie and the AVP game were amazing and are extremely underrated.,good year predat movi avp game amaz extrem underr
24,uzqYqoVoU74,OK people who say that this movie was trash are the same ones that want predator from 1986,ok peopl say movi trash one want predat
25,uzqYqoVoU74,The story was a rehash of the first predator!,stori rehash first predat
26,uzqYqoVoU74,"The trailer lies showing a scene with 15 shoulder cannon lasers on him but there&#39;s only 3 &#39;bad&#39; predators and the token 1 &#39;good guy&#39; predator. The team loses half their weapons and ammo in the first 5 minutes, a complete waste of time and money. Lawrence Fishburn&#39;s character is only introduced halfway through.",trailer lie show scene shoulder cannon laser bad predat token good guy predat team lose half weapon ammo first minut complet wast time money lawrenc fishburn charact introduc halfway
27,uzqYqoVoU74,Pretty Good Movie. But wow amazing trailer.,pretti good movi wow amaz trailer
28,uzqYqoVoU74,its not even close to the predator 1987,even close predat
29,uzqYqoVoU74,Where are the catholic priest?,cathol priest
30,uzqYqoVoU74,"The awesome shot of like 20 predator things going on Adrian Brody would be great if it were IN THE MOVIE and not just there to fool people into buying a ticket<br>Regardless, still a cool movie",awesom shot like predat thing go adrian brodi would great movi fool peopl buy ticketregardless still cool movi
31,uzqYqoVoU74,Why didn’t they get a sequel!? Instead with got that Predator lore destroying piece of garbage The Predator (2018)...,get sequel instead got predat lore destroy piec garbag predat
32,uzqYqoVoU74,This is the second best predator movie after Schwarsniger,second best predat movi schwarsnig
33,uzqYqoVoU74,Missing 411.,miss
34,uzqYqoVoU74,This movie was actually good!! The one that just came out though....no,movi actual good one came though
35,uzqYqoVoU74,So much better than The Predator (2018) wish this would’ve had a sequel.,much better predat wish would sequel
36,uzqYqoVoU74,Kill or be killed,kill kill
37,uzqYqoVoU74,I watched the movie at 5 years old :/,watch movi year old
38,uzqYqoVoU74,I hate how they got Walt Goggins and Machete to be in this turd.<br>I would not have seen it otherwise,hate got walt goggin machet turd would seen otherwis
39,uzqYqoVoU74,predators vs predators...YOUTUBE IS DRUNK 😅😂,predat vs predat youtub drunk
40,uzqYqoVoU74,"On one hand, I do think this this is a better Predator movie than The Predator, but on the other I feel it borrows too much from the original film. At least I can say that The Predator was too different. With this movie, it seems more like a copy/paste sorta deal. Don’t get me wrong, I don’t hate either movie, I like them both well enough. I just feel that I can respect The Predator a bit more for having the balls to change things and do things differently than play it safe by copying/pasting certain ideas and plot points.<br><br>To put it simply, I feel that The Predator’s frustrating mistakes make it more memorable than Predators, which I almost always forget exists.",one hand think better predat movi predat feel borrow much origin film least say predat differ movi seem like copi past sorta deal get wrong hate either movi like well enough feel respect predat bit ball chang thing thing differ play safe copi past certain idea plot point put simpli feel predat frustrat mistak make memor predat almost alway forget exist
41,uzqYqoVoU74,This one and the Original are the best movies.,one origin best movi
42,uzqYqoVoU74,I feel like this is the only REAL Predator sequel. Personally a huge favorite for me. Gotta love Royce with that AA-12,feel like real predat sequel person huge favorit got ta love royc aa
43,uzqYqoVoU74,I love part 1 but this was the best Predator movie,love part best predat movi
44,uzqYqoVoU74,"I like so much movies with machete), the last ones is amazing. This movie is in my favorite list on boxxy software",like much movi machet last one amaz movi favorit list boxxi softwar
45,uzqYqoVoU74,"It be awesome if they made a 2nd predators, with a the other people that come at the end except with Adrian brody to.",awesom made nd predat peopl come end except adrian brodi
46,uzqYqoVoU74,"This one I seen on Showbox, but date have for 2018, which is fucked up.",one seen showbox date fuck
47,uzqYqoVoU74,The movie was great but the trailer is a 5/10,movi great trailer
48,uzqYqoVoU74,"Old Painless Jr. at <a href=""https://www.youtube.com/watch?v=uzqYqoVoU74&amp;t=0m32s"">0:32</a>",old painless jr
49,uzqYqoVoU74,This movie wasn’t that great until the Shane Black predator came out. Now predators is amazing compared to the new one,movi great shane black predat came predat amaz compar new one
50,uzqYqoVoU74,PREDATORS: KILLING MACHINE finale sequel which ties PREDATORS (2010) and THE PREDATOR into a new trilogy. _c.,predat kill machin final sequel tie predat predat new trilog c
51,uzqYqoVoU74,"Everyone came here after The Predator, lol.",everyon came predat lol
52,uzqYqoVoU74,My favorite of the Predator saga,favorit predat saga
53,uzqYqoVoU74,"I&#39;m not gonna lie, this wasn&#39;t a great film, the trailer is fantastic though, which lead me to this conclusion:<br>1.Why making different Predators in this movie? If they would have stay with the original concept of the Predator, that would have worked just fine.<br>2. Why casting the guy from that&#39;s 70 show? He&#39;s not menacing at all and his acting sucks.<br>3. Why not writing something FOR the Predator instead of writing AGAINST it? The always tell us the story of how Predators lose against humans... BOORINGGG, make the Predators win for once to show us how menacing this creature is.<br>4. I would have like the story to tell us how the Predators were using this planet to train &quot;new bloods&quot; or hunters with no experience into hunting while having high ranking predators watching them and evaluating them, for example 5 high ranking Predators watching while 3 &quot;newbie&quot; Predators would hunt for recognition of their elders.<br><br>Maybe my ideas are terrible, but I bet is way better than the film they gave us and definitely better than the one from Shane Black which is pure garbage.",gon na lie great film trailer fantast though lead conclus make differ predat movi would stay origin concept predat would work fine cast guy show menac act suck write someth predat instead write alway tell us stori predat lose human booringgg make predat win show us menac creatur would like stori tell us predat use planet train quot new blood quot hunter experi hunt high rank predat watch evalu exampl high rank predat watch quot newbi quot predat would hunt recognit elder mayb idea terribl bet way better film gave us definit better one shane black pure garbag
54,uzqYqoVoU74,This is a great movie. Very awesome.,great movi awesom
55,uzqYqoVoU74,I actually liked this film,actual like film
56,uzqYqoVoU74,That trailer gets me every time well done,trailer get everi time well done
57,uzqYqoVoU74,"If they do consider doing a sequel, they should at least get Adrian brody and Alice braga to return as the characters they played and in the first act of the movie being these two finally getting off the planet and returning to earth, only to find out that there’s another team of predators coming to earth as well to not only bring Royce and Isabelle back, but to retrieve more warriors from earth for their game reserve",consid sequel least get adrian brodi alic braga return charact play first act movi two final get planet return earth find anoth team predat come earth well bring royc isabel back retriev warrior earth game reserv
58,uzqYqoVoU74,"Sadly this movie had the scary vibe to it, other than the new predator film. Shane blacks very was okay, I just wish it was scary like this one.",sadli movi scari vibe new predat film shane black okay wish scari like one
59,uzqYqoVoU74,I liked this movie better then the new one .,like movi better new one
60,uzqYqoVoU74,Way way better than that piece of shot out in theaters now.,way way better piec shot theater
61,uzqYqoVoU74,This is a fuckin classic compared to the bullshit that&#39;s out now...Fox should have hired Nimrod Antal again and made a sequel to Predators.,fuckin classic compar bullshit fox hire nimrod antal made sequel predat
62,uzqYqoVoU74,To all the folks who hated this movie and kept complaining about it.... How you loving that Shane Black comedy fest now???😂😂😂,folk hate movi kept complain love shane black comedi fest
63,uzqYqoVoU74,"This was a good movie plot wise, I just was not a fan of the “Super Predators” looks. Head way too big, mandibles way out of proportion, and the idea of 3<br>Of them. Imagine replacing the 3 Predators in this movie with the new upgraded Assassin Predator from the new movie. That would have been a lot cooler.",good movi plot wise fan super predat look head way big mandibl way proport idea imagin replac predat movi new upgrad assassin predat new movi would lot cooler
64,uzqYqoVoU74,The new predator movie&#39;s film quality like more older than this one,new predat movi film qualiti like older one
65,uzqYqoVoU74,This movie could have been so much better,movi could much better
66,uzqYqoVoU74,Underrated movie,underr movi
67,uzqYqoVoU74,this was better then the recent The Predator.,better recent predat
68,uzqYqoVoU74,Predator rules,predat rule
69,uzqYqoVoU74,"The concept for this movie is brilliant. Honestly, this is how a predator tv series could be made, with a cast of new people ever season with some familiar faces who survived before in the previous hunting seasons. Would be cool.",concept movi brilliant honestli predat tv seri could made cast new peopl ever season familiar face surviv previou hunt season would cool
70,uzqYqoVoU74,"Honestly this was a well done movie, not better than the first, but it doesn’t matter cuz I still loved it.",honestli well done movi better first matter cuz still love
71,uzqYqoVoU74,"Still the best Predator sequel I&#39;ve seen since the original, the worst part is the sequel bait ending which all too many films do now, but all in all a decent sequel.  I really haven&#39;t been overly impressed with any of the advertising regarding the newest predator movie, the film looks tonally inconsistent, and early reviews seem to highlight that as a problem.",still best predat sequel seen sinc origin worst part sequel bait end mani film decent sequel realli overli impress advertis regard newest predat movi film look tonal inconsist earli review seem highlight problem
72,uzqYqoVoU74,what is luca changretta doing here,luca changretta
73,uzqYqoVoU74,"I always liked the concept presented in this movie, but I don&#39;t think it&#39;s very good. I definitely think it&#39;s better than AVP and AVP 2.",alway like concept present movi think good definit think better avp avp
74,uzqYqoVoU74,"I remember seeing this trailer on adult swim as a kid, and no believed me when I said a new predator movie was coming out.",rememb see trailer adult swim kid believ said new predat movi come
75,uzqYqoVoU74,❤ this movie 💯,movi
76,uzqYqoVoU74,Decent trailer does not catch my eye i like the new trailer that came out yesterday for the violence and how it made it look like logan but i have not seen this movie because i cant find it any where in stores i could habe got it in a predator set but theni would have have 3 predator 1 and 3 predator 2s,decent trailer catch eye like new trailer came yesterday violenc made look like logan seen movi cant find store could habe got predat set theni would predat predat
77,uzqYqoVoU74,Had to revisit this great movie after watching that garbage last trailer for Shane Blacks Michael Bay&#39;d schlock called Predator.,revisit great movi watch garbag last trailer shane black michael bay schlock call predat
78,uzqYqoVoU74,Way better than the 2018 trailer..,way better trailer
79,uzqYqoVoU74,"Good premise to this film and I genuinely enjoyed multiple aspects/sequences of this film.<br> <br>Ultimately and unfortunately, it undermined it&#39;s own originality in the series by copying the first film inappropriately(minigun dude, falling by waterfall, etc.) But the worst offense is when Isabelle reveals to the group how wearing mud helped Dutch survive the encounter with the Predator from the first film, then next sequence, nobody&#39;s wearing any mud. lol <br><br>Given, Royce eventually takes the advice, but still, it&#39;s one of the most irrationally written sequences I&#39;ve ever witnessed in any film and shouldn&#39;t have made the final cut.",good premis film genuin enjoy multipl aspect sequenc film ultim unfortun undermin origin seri copi first film inappropri minigun dude fall waterfal etc worst offens isabel reveal group wear mud help dutch surviv encount predat first film next sequenc nobodi wear mud lol given royc eventu take advic still one irrat written sequenc ever wit film made final cut
80,uzqYqoVoU74,"This movie has the right formula..it could have been better. I enjoyed this however, it could have had more twists in the plot and kept us wanting more.",movi right formula could better enjoy howev could twist plot kept us want
81,uzqYqoVoU74,This movie should have gotten a sequel.,movi gotten sequel
82,uzqYqoVoU74,The original battle royal,origin battl royal
83,uzqYqoVoU74,There’s a scene in this trailer that shows a total of 15 lasers meaning 15 predators but in the movie theres only 4...,scene trailer show total laser mean predat movi there
84,uzqYqoVoU74,"Why did they change the trailer? If you watch the other ones on YouTube, they&#39;re different...",chang trailer watch one youtub differ
85,uzqYqoVoU74,Watch (Arnold loves the  new predators movie) lol,watch arnold love new predat movi lol
86,uzqYqoVoU74,"This was an underrated movie, and the cast was great choice and they did a great job.<br><br>This is also how you do your trailer right! You show very little (if you want to show) of your creature in the trailer. Something the new Alien movie, did not do correctly in their trailer.",underr movi cast great choic great job also trailer right show littl want show creatur trailer someth new alien movi correctli trailer
87,uzqYqoVoU74,Such an underrated film,underr film
88,uzqYqoVoU74,Still better than Shane Blacks Predator,still better shane black predat
89,uzqYqoVoU74,"This trailer is so good imo, I hope they make the official trailer for the movie just good as this and not like the teaser one.",trailer good imo hope make offici trailer movi good like teaser one
90,uzqYqoVoU74,"Imo, predators was a good movie, not better than the first 2, but I just love that it doesn&#39;t take place in our planet anymore, and that we see a little bit more about predator conflict with others predators.   My only 2 complains was that there wasn&#39;t enough predators on it, and the way the kill them was mediocre, anyways I would want to see a sequel of this movie, I feel like it has enough potential for a good predator movie.",imo predat good movi better first love take place planet anymor see littl bit predat conflict other predat complain enough predat way kill mediocr anyway would want see sequel movi feel like enough potenti good predat movi
91,uzqYqoVoU74,This is how you make a REAL predator movie.,make real predat movi
92,uzqYqoVoU74,To better trailer than the one that we just got today,better trailer one got today
93,uzqYqoVoU74,This is a masterpiece compared to the piece of crap trailer for the new movie i just watched.,masterpiec compar piec crap trailer new movi watch
94,uzqYqoVoU74,This was a good movie,good movi
95,uzqYqoVoU74,Shouldn&#39;t there be a part 2?,part
96,uzqYqoVoU74,"<a href=""http://www.youtube.com/watch?v=uzqYqoVoU74&amp;t=0m33s"">0:33</a> Remy Denton!",remi denton
97,uzqYqoVoU74,"False F..kin advertisement at <a href=""http://www.youtube.com/watch?v=uzqYqoVoU74&amp;t=1m23s"">1:23</a>!!! In the movie only ONE trilaser on Brody&#39;s face, and this trailer shows more than a dozen trilasers!!!! Thanks buttholes!!",fals f kin advertis movi one trilas brodi face trailer show dozen trilas thank butthol
98,uzqYqoVoU74,this movie look&#39;s cool,movi look cool
99,uzqYqoVoU74,This is a great film! Must of missed it but will watch soon !!! Also Keep on the look out for Dino Earth : Beyond the Darkness,great film must miss watch soon also keep look dino earth beyond dark
100,uzqYqoVoU74,Is Michelle Rodriquez a man or woman?,michel rodriquez man woman
101,uzqYqoVoU74,Fuck yes!!!!!  There is hope!,fuck ye hope
102,uzqYqoVoU74,Vagina Face!!!!! lol,vagina face lol
103,uzqYqoVoU74,1:23 ?,
104,uzqYqoVoU74,This movie is trash if you&#39;re a Predator fan.,movi trash predat fan
105,uzqYqoVoU74,"great movie, i suggest all go and see its totally worth seeing and will make i happy",great movi suggest go see total worth see make happi
106,uzqYqoVoU74,"Make it more gory in the sequel and John Leguizamo needs to Co-Star in the predators sequel, he needs to be in better films. Loved Him and Brody in Summer of Sam, hope they re-team in predators2.",make gori sequel john leguizamo need co star predat sequel need better film love brodi summer sam hope team predat
107,uzqYqoVoU74,"The movie was a worthy good sequel,",movi worthi good sequel
110,uzqYqoVoU74,@Lokey76 u fucking spoiler,lokey u fuck spoiler
111,uzqYqoVoU74,"awesome movie, loved the yakusa vs. predator scene, old skool samurai showdown fight!!!!",awesom movi love yakusa vs predat scene old skool samurai showdown fight
112,uzqYqoVoU74,rRrRrRr!!!,rrrrrrr
113,uzqYqoVoU74,Subtitula P!,subtitula p
115,uzqYqoVoU74,good job,good job
116,uzqYqoVoU74,"I loved the movie, it was better than the 2nd. My only problem was the plot hole ending. Don&#39;t worry, I won&#39;t spoil it for you.",love movi better nd problem plot hole end worri spoil
117,uzqYqoVoU74,COOL! :D,cool
118,uzqYqoVoU74,"OK movie, left the same feeling as from previous series",ok movi left feel previou seri
119,O7a-hmoh6Jw,It&#39;s the test screening for Batman V Superman,test screen batman v superman
120,O7a-hmoh6Jw,There dumb if a saw a door slam shut I would be out of that house so fast like white people dont think,dumb saw door slam shut would hous fast like white peopl dont think
121,O7a-hmoh6Jw,Why is it always in a new house,alway new hous
122,O7a-hmoh6Jw,I guess the room is just full of old sperm from 1800 because the title is &quot;The disappointments room&quot;.,guess room full old sperm titl quot disappoint room quot
123,O7a-hmoh6Jw,Cant wait for the next Underworld with Kate Beckinsale :)<br>Looks like a hard movie.,cant wait next underworld kate beckinsal look like hard movi
124,O7a-hmoh6Jw,The room was empty. Thus the name of the movie The Disappointment Room,room empti thu name movi disappoint room
125,O7a-hmoh6Jw,Well this trailer literally told me nothing of the plot...,well trailer liter told noth plot
126,O7a-hmoh6Jw,hmmmmmmmmmmmmmmmm............,hmmmmmmmmmmmmmmmm
127,O7a-hmoh6Jw,This looked genuinely unnerving! Good stuff!,look genuin unnerv good stuff
128,O7a-hmoh6Jw,So behind that door is a...disappointment?,behind door disappoint
129,O7a-hmoh6Jw,"Y&#39;know what, even if the base premise is unoriginal, the latter half of this trailer isn&#39;t that bad.",know even base premis unorigin latter half trailer bad
130,O7a-hmoh6Jw,just watched because of kate Beckinsale,watch kate beckinsal
131,O7a-hmoh6Jw,I&#39;ll drink Kate Beckinsale&#39;s bath water.,drink kate beckinsal bath water
132,O7a-hmoh6Jw,"By the trailer and the comments, people are going to watch this movie because of the actress, maybe.<br>Everything else will be strange to the audience, for example, they bought the house for &quot; a new beginning&quot; but didn&#39;t bother to check the rooms with the realtor. Assuming they bought it online, what is the first thing you do when you buy a house and you arrive for the first time? ...exactly, check the rooms right away but she didn&#39;t do this till we can see her &quot;discovering&quot; that &quot;hidden&quot; door and only because she is following a shadow.<br>Also, if you buy a house and you find it has a statue with no head and hands would you take pictures of it?  It doesn&#39;t make sense.",trailer comment peopl go watch movi actress mayb everyth els strang audienc exampl bought hous quot new begin quot bother check room realtor assum bought onlin first thing buy hous arriv first time exactli check room right away till see quot discov quot quot hidden quot door follow shadow also buy hous find statu head hand would take pictur make sens
133,O7a-hmoh6Jw,Hm. I get a real &quot;Shining&quot; vibe from this. Maybe it&#39;ll be better than the usual crap. :p,hm get real quot shine quot vibe mayb better usual crap p
134,O7a-hmoh6Jw,Something tells me that what&#39;s inside the room is going to be a disappointment.,someth tell insid room go disappoint
135,O7a-hmoh6Jw,Remove the word &quot;disappointments&quot; and you have the best movie of all time,remov word quot disappoint quot best movi time
