,ID,comments,cleaned_comments
2383,RLoKtb4c4W0,What up captain marvel 😂,captain marvel
2384,RLoKtb4c4W0,"<a href=""https://www.youtube.com/watch?v=RLoKtb4c4W0&amp;t=1m32s"">1:32</a> Dakota Johnson of Fifty Shades of Grey.",dakota johnson fifti shade grey
2385,RLoKtb4c4W0,Name jeff,name jeff
2386,RLoKtb4c4W0,who is hear for Brie Larson after watching her Captian Marvel,hear brie larson watch captian marvel
2387,RLoKtb4c4W0,Waiting for 23 jump street,wait jump street
2388,RLoKtb4c4W0,Has anyone noticed that in the trailer he says &quot;21 jump street&quot; but in the movie he says &quot;37 jump street&quot; ?,anyon notic trailer say quot jump street quot movi say quot jump street quot
2389,RLoKtb4c4W0,cult classic,cult classic
2390,RLoKtb4c4W0,Who made it here when Captain Marvel trailer was released?,made captain marvel trailer releas
2391,RLoKtb4c4W0,"Very shitty, wasting of time, big dislike",shitti wast time big dislik
2392,RLoKtb4c4W0,Channing Tatum ❤️❤️,chan tatum
2393,RLoKtb4c4W0,21 Jump Street(2012) Imdb,jump street imdb
2394,RLoKtb4c4W0,Lol I remember watching this movie in the second grade good times,lol rememb watch movi second grade good time
2395,RLoKtb4c4W0,وين بدي احضره كامل,
2396,RLoKtb4c4W0,"<a href=""https://www.youtube.com/watch?v=RLoKtb4c4W0&amp;t=1m32s"">1:32</a> is that Dakota Johnson???",dakota johnson
2397,RLoKtb4c4W0,si si vjen turp gjithe ai xham makine qorri,si si vjen turp gjith ai xham makin qorri
2398,RLoKtb4c4W0,My favorite movie 😘😘,favorit movi
2399,RLoKtb4c4W0,Lol😂😁😂,lol
2400,RLoKtb4c4W0,Terrible movie,terribl movi
2401,RLoKtb4c4W0,The best movie ever you need to watch that !! Channing Tatum🤞😍😍💍,best movi ever need watch chan tatum
2402,RLoKtb4c4W0,I`ve not seen this but must think this trailer is epic.,seen must think trailer epic
2403,RLoKtb4c4W0,23 jump street,jump street
2404,RLoKtb4c4W0,my name is jeff,name jeff
2405,RLoKtb4c4W0,The whole movie is on drugs,whole movi drug
2406,RLoKtb4c4W0,My names jeff,name jeff
2407,RLoKtb4c4W0,The memories 😭:&#39;(,memori
2408,RLoKtb4c4W0,My name is Jeff,name jeff
2409,RLoKtb4c4W0,when is this movie comming out,movi com
2410,RLoKtb4c4W0,so great,great
2411,RLoKtb4c4W0,Funniest movie Ive ever seen. I cried rivers of tears in laughter. Pt2 is equally funny,funniest movi ive ever seen cri river tear laughter pt equal funni
2412,RLoKtb4c4W0,wow this movie is really good,wow movi realli good
2413,RLoKtb4c4W0,my nam a jeff,nam jeff
2414,RLoKtb4c4W0,"Such a great movie!!!<br> such a bad trailer... come on, it&#39;s the whole story wrapped up in 3 minutes.",great movi bad trailer come whole stori wrap minut
2415,RLoKtb4c4W0,so crazy movie😲😲😉😉😂😂 and so funny,crazi movi funni
2416,RLoKtb4c4W0,Ice cube made me lose my drink everytime man XD,ice cube made lose drink everytim man xd
2417,RLoKtb4c4W0,I’m 12 is this ok to watch <br>And my sister is 7 but does watch Pg 13 of m movies,ok watch sister watch pg movi
2418,RLoKtb4c4W0,"I remember when I first heard that this movie is happening, I thought it will suck really badly. And when this trailer came out, it didn&#39;t help. Boy was I wrong. This is genuinely one of the funniest comedies I&#39;ve seen in years.",rememb first heard movi happen thought suck realli badli trailer came help boy wrong genuin one funniest comedi seen year
2419,RLoKtb4c4W0,"&quot;Infiltrate the dealer, find the supplier!&quot;",quot infiltr dealer find supplier quot
2420,RLoKtb4c4W0,the worst trailer,worst trailer
2421,RLoKtb4c4W0,What&#39;s that Beastie Boys sounding song?,beasti boy sound song
2422,RLoKtb4c4W0,I&#39;m here cuz it&#39;s Grayson Dolans Fave movie(well I read a fact).,cuz grayson dolan fave movi well read fact
2423,RLoKtb4c4W0,Anastasia looks hot.,anastasia look hot
2424,RLoKtb4c4W0,the part when they are on drugs gets me all the time,part drug get time
2425,RLoKtb4c4W0,I would rather watch this movie 🎥 rather than Superbad any day! This movie 🎥 is funnier than super bad! Superbad is overrated but this film is hilarious!😆 😂,would rather watch movi rather superbad day movi funnier super bad superbad overr film hilari
2426,RLoKtb4c4W0,"Wow, Johnny Depp was definitely a surprise. Didn&#39;t expect that.",wow johnni depp definit surpris expect
2427,RLoKtb4c4W0,pretty much how you&#39;d describe me and my friend,pretti much describ friend
2428,RLoKtb4c4W0,Can someone tell me a movie that has the same vibes with this one?,someon tell movi vibe one
2429,RLoKtb4c4W0,Never would have guessed how good this movie was based on the trailer.,never would guess good movi base trailer
2430,RLoKtb4c4W0,efe aydaldan gelenler,efe aydaldan gelenl
2431,RLoKtb4c4W0,I think that  this is Graysons Dolans fav movie,think grayson dolan fav movi
2432,RLoKtb4c4W0,لمشاهدة فيلم Jump Street 21&amp;22 بوضوح HD  مترجم .. ادخل على قناتي موجودين دون روابط بس لا تنسى    اللايك و الاشتراك لاني تعبت على المقطع..اخي الكريم,jump street amp hd
2433,RLoKtb4c4W0,"I thought this will be bullshit, but man it was a laugh riot!!!",thought bullshit man laugh riot
2434,RLoKtb4c4W0,ooooo.... love this movie!,ooooo love movi
2435,RLoKtb4c4W0,"this is just the best bits of the movie, in order, showing every plot point with music in the background",best bit movi order show everi plot point music background
2436,RLoKtb4c4W0,"21 &amp; 22 jump street are hilarious and has funny moments, suck it ride along films &amp; let&#39;s be cops.",amp jump street hilari funni moment suck ride along film amp let cop
2437,RLoKtb4c4W0,"<a href=""http://www.youtube.com/watch?v=RLoKtb4c4W0&amp;t=03m11s"">03:11</a> what he is said? turkish translation  please",said turkish translat pleas
2438,RLoKtb4c4W0,MYNAMAJEFF,mynamajeff
2439,RLoKtb4c4W0,I really watch the movie like million times and still laugh harder every time.,realli watch movi like million time still laugh harder everi time
2440,RLoKtb4c4W0,best movie eveeerrr. the trailer kind of sucked though. its good i watched the movie before its trailer,best movi eveeerrr trailer kind suck though good watch movi trailer
2441,RLoKtb4c4W0,toast,toast
2442,RLoKtb4c4W0,placa someone call me the letter oficial trailer pls,placa someon call letter ofici trailer pl
2443,RLoKtb4c4W0,"<a href=""http://www.youtube.com/watch?v=RLoKtb4c4W0&amp;t=0m09s"">0:09</a> not so slim shady",slim shadi
2444,RLoKtb4c4W0,"Channing Tatum fit that part so well<br><a href=""http://www.youtube.com/results?search_query=%23MyNamesJeff"">#MyNamesJeff</a>",chan tatum fit part well mynamesjeff
2445,RLoKtb4c4W0,&quot;The fact that you look like a fucken 40 year old man..&quot;  LMAO,quot fact look like fucken year old man quot lmao
2446,RLoKtb4c4W0,Do you recommend it I like Channing Tatum<br>And and think he hot is it a good movie to watch,recommend like chan tatumand think hot good movi watch
2447,RLoKtb4c4W0,amazing movie but not a good trailer,amaz movi good trailer
2448,RLoKtb4c4W0,this is me movie i love it,movi love
2449,RLoKtb4c4W0,"Yes this trailer show whole movie , but it&#39;s good movie :)",ye trailer show whole movi good movi
2450,RLoKtb4c4W0,U just showed the full movie,u show full movi
2451,RLoKtb4c4W0,got the movie,got movi
2452,RLoKtb4c4W0,"You Some Justin Bieber, Miley Cyrus Looking Muthafuckas!",justin bieber miley cyru look muthafucka
2453,RLoKtb4c4W0,21 jump street was such a badass movie,jump street badass movi
2454,RLoKtb4c4W0,I love thismovie channing Tatum.....fit:)!!,love thismovi chan tatum fit
2455,RLoKtb4c4W0,"i writing this comment using internet explorer , certainly this comment will apear in the future , anyway happy new year 2007 !",write comment use internet explor certainli comment apear futur anyway happi new year
2456,RLoKtb4c4W0,jonah hill gotta hotter prom date than i ever will!!,jonah hill got ta hotter prom date ever
2457,RLoKtb4c4W0,my fav movie,fav movi
2458,RLoKtb4c4W0,"<a href=""http://youtu.be/RLoKtb4c4W0?t=1m26s"">1:26</a> RON SWANSON",ron swanson
2459,RLoKtb4c4W0,I cant believe this movie was made in 2012,cant believ movi made
2460,RLoKtb4c4W0,"<a href=""http://www.youtube.com/watch?v=RLoKtb4c4W0&amp;t=1m32s"">1:32</a> is that the girl from fifty shades?",girl fifti shade
2461,RLoKtb4c4W0,watched 21 times BOOOOOOOOOOM MATHA FUCKAS,watch time boooooooooom matha fucka
2462,RLoKtb4c4W0,my name is &quot;jeff&quot;,name quot jeff quot
2463,RLoKtb4c4W0,"Have you seen this guy&#39;s recut, search: DaffyDoctorGuy.<br>Its been re-edited as a serious film trailer, lol",seen guy recut search daffydoctorguy edit seriou film trailer lol
2464,RLoKtb4c4W0,I can&#39;t masturbate to this.,masturb
2465,RLoKtb4c4W0,The whole movie in 3 minutes. Wel done editors,whole movi minut wel done editor
2466,RLoKtb4c4W0,"From Phil Lord and Christopher Miller, the directors of Cloudy With a Chance of Meatballs and The Lego Movie.....................",phil lord christoph miller director cloudi chanc meatbal lego movi
2467,RLoKtb4c4W0,Going to see it soon :),go see soon
2468,RLoKtb4c4W0,@JoshTheCritic,joshthecrit
2470,RLoKtb4c4W0,thank GOD i din&#39;t like the facebook page,thank god din like facebook page
2471,RLoKtb4c4W0,@JoshTheCritic Bounce by mstrkrft feat n.o.r.e and isis,joshthecrit bounc mstrkrft feat n r e isi
2472,RLoKtb4c4W0,@MyLifeIsSh1t   No.,mylifeissh
2473,RLoKtb4c4W0,Johnny Depp is rolling in his grave.,johnni depp roll grave
2474,RLoKtb4c4W0,Song?,song
2475,RLoKtb4c4W0,sigh..... why is this set in a high school.....why not a fucking community college....lots of drugs at a community college.....iced tea went to a community college...Im positive.,sigh set high school fuck commun colleg lot drug commun colleg ice tea went commun colleg im posit
2476,RLoKtb4c4W0,This looks really bad.,look realli bad
2477,RLoKtb4c4W0,This looks wayyy too mean spirited. And I never get offended by swearing but does anyone else think that it&#39;s completely unfunny and unnessecary in this trailer?,look wayyy mean spirit never get offend swear anyon els think complet unfunni unnessecari trailer
2478,RLoKtb4c4W0,Depp rotates in his grave.,depp rotat grave
2479,RLoKtb4c4W0,"no.  no.  no.  this looks like fucking shit.  i like jonah hill but there&#39;s more to him than this.  and also, channing tatum can&#39;t fucking act worth a shit.  i can barely understand half the shit he says as he mumbles throughout the entire film.",look like fuck shit like jonah hill also chan tatum fuck act worth shit bare understand half shit say mumbl throughout entir film
2480,RLoKtb4c4W0,lame..,lame
2483,RLoKtb4c4W0,This movie looks hillarious. Too bad they slapped the name &quot;21 Jump Street&quot; on it. Because it&#39;s not. Nawmean?,movi look hillari bad slap name quot jump street quot nawmean
2484,RLoKtb4c4W0,"What&#39;s killing me is all the cursing and slapstick. 21 Jump Street didn&#39;t have all that. They had moments of humor sure, but everything else was drama and badass 80s action!",kill curs slapstick jump street moment humor sure everyth els drama badass action
2485,RLoKtb4c4W0,I knew the minute I heard Jonah Hill was writing this project it would suck. 21 Jump Street is and always should be a drama. A little comedy in it is not a bad thing but to make it a complete comedy it will suck majorly. Here is how I believe the movie will go down.,knew minut heard jonah hill write project would suck jump street alway drama littl comedi bad thing make complet comedi suck majorli believ movi go
2487,jYk2Vx1z6lk,Reminded me of the game Bully before the music part.,remind game bulli music part
2488,jYk2Vx1z6lk,"What is the song called which is playing at <a href=""http://www.youtube.com/watch?v=jYk2Vx1z6lk&amp;t=2m05s"">2:05</a>.",song call play
2489,jYk2Vx1z6lk,Anyone know the song towards the end of the trailer?,anyon know song toward end trailer
2490,jYk2Vx1z6lk,Looks really good I will definitely go see this.,look realli good definit go see
2491,jYk2Vx1z6lk,Clicked on this one because it said that the trailer had Aiden Gillen and Maria Doyle Kennedy and they were barely in it.,click one said trailer aiden gillen maria doyl kennedi bare
2492,jYk2Vx1z6lk,Song in the last scene?,song last scene
2493,jYk2Vx1z6lk,you&#39;re a big potato,big potato
2494,jYk2Vx1z6lk,what are you doing there Littlefinger?,littlefing
2495,jYk2Vx1z6lk,Was being transferred to a new school part of your plan?,transfer new school part plan
2496,jYk2Vx1z6lk,Was getting transferred part of your plan?,get transfer part plan
2497,jYk2Vx1z6lk,I&#39;m going to watch this for the music and the good old feel/nostalgia.,go watch music good old feel nostalgia
2498,jYk2Vx1z6lk,Is this movie about Duran Duran? I did t get anything from this trailer,movi duran duran get anyth trailer
2499,jYk2Vx1z6lk,"Uhh, you don&#39;t get to transfer students...",uhh get transfer student
2500,jYk2Vx1z6lk,"Yeah, just go ahead and spoil the whole frickin&#39; film. -_-",yeah go ahead spoil whole frickin film
2501,jYk2Vx1z6lk,"i feel like i already saw the entire movie in the trailer lol. but i liked once and begin again, so I&#39;ll probably check it out.",feel like alreadi saw entir movi trailer lol like begin probabl check
2502,jYk2Vx1z6lk,Littlefinger?,littlefing
2503,jYk2Vx1z6lk,My type of movie!<br><br>I love coming of age movies and this looks similar to Almost Famous which I loved!,type movi love come age movi look similar almost famou love
2504,jYk2Vx1z6lk,Waiting on The Beatles movie with real actors,wait beatl movi real actor
2505,jYk2Vx1z6lk,Little finger!,littl finger
2506,jYk2Vx1z6lk,this looks 20 times better than rock of ages !,look time better rock age
2507,jYk2Vx1z6lk,I have to know that the ending song is from this trailer. The tune is going to be stuck in my head for days,know end song trailer tune go stuck head day
2508,jYk2Vx1z6lk,"What&#39;s the name of that song, the final one?",name song final one
2509,jYk2Vx1z6lk,"Doesn&#39;t look new, but also doesn&#39;t look bad ... Plus director of once and begin again? Might actually be good!",look new also look bad plu director begin might actual good
2510,jYk2Vx1z6lk,SOMEONE NAME THAT SONG,someon name song
2511,jYk2Vx1z6lk,i ve to say: Nice tráiler!,say nice tr iler
2512,jYk2Vx1z6lk,sure to be a hit. i get good vibes from this and it also reminds me of the 80&#39;s for some reason.,sure hit get good vibe also remind reason
2513,jYk2Vx1z6lk,"whats thesong that starts a <a href=""http://www.youtube.com/watch?v=jYk2Vx1z6lk&amp;t=1m35s"">1:35</a> til the end. i hope someone knows.",what thesong start til end hope someon know
2514,jYk2Vx1z6lk,last song?!,last song
2515,jYk2Vx1z6lk,That girl sounds like Luna Lovegood,girl sound like luna lovegood
2516,jYk2Vx1z6lk,"I didn&#39;t think much of this trailer at first but this actually might win an academy award, I feel...",think much trailer first actual might win academi award feel
2517,jYk2Vx1z6lk,Muah!,muah
2518,jYk2Vx1z6lk,"What is the song starting to play at around <a href=""http://www.youtube.com/watch?v=jYk2Vx1z6lk&amp;t=1m40s"">1:40</a> till the end? Please reply if you know. Thanks",song start play around till end pleas repli know thank
2519,jYk2Vx1z6lk,Lord Baelish having financial problems... It&#39;s just doesn&#39;t make any sense!!!,lord baelish financi problem make sens
2520,jYk2Vx1z6lk,Little finger!!!!,littl finger
2521,jYk2Vx1z6lk,im only gonna watch this because of THE CURE.,im gon na watch cure
2522,jYk2Vx1z6lk,I wounder who keep making these long-ass trailers that basically show every major scene and the climax of the movie? This is one of the few dramas I want to see. But I already know EVERYTHING that going to happen.,wounder keep make long ass trailer basic show everi major scene climax movi one drama want see alreadi know everyth go happen
2523,jYk2Vx1z6lk,I thought it&#39;s joey graceffa in the thumbnail,thought joey graceffa thumbnail
2524,jYk2Vx1z6lk,that closing song is great :D,close song great
2525,jYk2Vx1z6lk,I thought this movie was about Mayor Carcetti the Master of Coin.,thought movi mayor carcetti master coin
2526,jYk2Vx1z6lk,"Son, I&#39;m CIA.<br>Uh, you don&#39;t get to transfer schools.",son cia uh get transfer school
2527,jYk2Vx1z6lk,Sing Street....Beat Street....hmmm.....,sing street beat street hmmm
2528,jYk2Vx1z6lk,"Look good..,I want to watch the whole of it.",look good want watch whole
2529,jYk2Vx1z6lk,I don&#39;t think this trailer did what it wanted to. It got me hyped for the next season of game of thrones.,think trailer want got hype next season game throne
2530,jYk2Vx1z6lk,oruchumaru,oruchumaru
2531,jYk2Vx1z6lk,"The 80s gave way to a lot of legendary bands and music.  I think it&#39;s because back then creative priorities were different, and people were still truly free to pursue and be whatever type of musicians they wanted to be, and most of all, experiment freely.  I always get this vibe from the 80&#39;s that people were more concerned with making music they liked, than fitting a certain genre, or having a specific &quot;marketable&quot; look just to sell themselves more than their music.  <b>Shooting at the walls of heartache, Bang, bang, I am the warrior!</b>",gave way lot legendari band music think back creativ prioriti differ peopl still truli free pursu whatev type musician want experi freeli alway get vibe peopl concern make music like fit certain genr specif quot market quot look sell music shoot wall heartach bang bang warrior
2532,jYk2Vx1z6lk,I&#39;m not thumbing down cause I think the movie will be bad. I&#39;m thumbing down how this trailer was cut.,thumb caus think movi bad thumb trailer cut
2533,jYk2Vx1z6lk,i want to see it,want see
2534,jYk2Vx1z6lk,"So, just to clarify: to get the girl, you need to pretend to be someone you&#39;re not, eventually transform into that fiction, and it will work out?  The Oldest Story in the Book that never told the truth once comes to mind.",clarifi get girl need pretend someon eventu transform fiction work oldest stori book never told truth come mind
2535,jYk2Vx1z6lk,"hey look, you can pay to listen to your favorite songs to the backdrop of some teen chasing a girl, and he gets her in the end. what a waste of money",hey look pay listen favorit song backdrop teen chase girl get end wast money
2536,jYk2Vx1z6lk,I want to watch this!,want watch
2537,jYk2Vx1z6lk,Oh a new Harry Potter Movie,oh new harri potter movi
2538,jYk2Vx1z6lk,Is... Is this seriously a movie about a band from Synge Street Primary/Secondary School in dublin?! If so those fights at the start are very relevant then. That place is a shit hole.,serious movi band syng street primari secondari school dublin fight start relev place shit hole
2539,jYk2Vx1z6lk,Love it!! The soundtrack is epic,love soundtrack epic
2540,jYk2Vx1z6lk,"<a href=""http://www.youtube.com/watch?v=jYk2Vx1z6lk&amp;t=1m18s"">1:18</a> pleaseeeee",pleaseeee
2541,jYk2Vx1z6lk,Will there leprechauns and pots of gold in this film............ffs,leprechaun pot gold film ff
2542,jYk2Vx1z6lk,Was creating a band part of your plan?,creat band part plan
2543,jYk2Vx1z6lk,Can anyone tell me the song at the end?,anyon tell song end
2544,jYk2Vx1z6lk,Here come the GOT references.,come got refer
2545,jYk2Vx1z6lk,I couldn&#39;t sit thru 5 mins of this shit,sit thru min shit
2546,jYk2Vx1z6lk,"Being a huge fan of The Commitments, I&#39;m looking forward to this",huge fan commit look forward
2547,jYk2Vx1z6lk,coming soon to a garage sale near you,come soon garag sale near
2548,jYk2Vx1z6lk,Tell me about bane why does he sing,tell bane sing
2549,jYk2Vx1z6lk,"Could&#39;ve been Genesis with Peter Gabriel though, just sayin.",could genesi peter gabriel though sayin
2550,jYk2Vx1z6lk,Looks good.,look good
2551,jYk2Vx1z6lk,Nice short film....,nice short film
2552,jYk2Vx1z6lk,"...you had me at, Take On Me. :P",take p
2553,jYk2Vx1z6lk,Actress in the thumbnail looks like if Zelena from OUAT wore Avatar Kyoshi&#39;s make-up.,actress thumbnail look like zelena ouat wore avatar kyoshi make
2554,jYk2Vx1z6lk,Tell me about Bane! Why is he in a band?,tell bane band
2555,jYk2Vx1z6lk,Did I just watch the whole movie?,watch whole movi
2556,jYk2Vx1z6lk,BANE?,bane
2557,jYk2Vx1z6lk,fuck...I listen to Phil Colins...,fuck listen phil colin
2558,jYk2Vx1z6lk,"At least, there aren&#39;t only &quot;street rap&quot; movies.",least quot street rap quot movi
2559,jYk2Vx1z6lk,"I saw many musical instruments, but where is BALALAIKA? Without BALALAIKA it is not cooool!",saw mani music instrument balalaika without balalaika cooool
2560,jYk2Vx1z6lk,I thought this was cobie smulders,thought cobi smulder
2561,jYk2Vx1z6lk,I&#39;m getting serious Son of Rambow vibes from this trailer and that&#39;s a very good thing.,get seriou son rambow vibe trailer good thing
2562,jYk2Vx1z6lk,Looks lame,look lame
2563,jYk2Vx1z6lk,"A nostalgia flick that isn&#39;t based in America! Yay! I love seeing different points of view on the same subject. Growing up in the 80&#39;s has been done to death in American cinema and so any European, Asian, or African perspectives are amazing.",nostalgia flick base america yay love see differ point view subject grow done death american cinema european asian african perspect amaz
2564,jYk2Vx1z6lk,So... The Commitments? With kids instead?,commit kid instead
2565,jYk2Vx1z6lk,By the numbers. Setting a movie in the 80s (fun clothes!) and in England (fun dialects!) doesn&#39;t change the fact that it hits every damn trope for a movie of this kind.<br>Wasted opportunity.,number set movi fun cloth england fun dialect chang fact hit everi damn trope movi kind wast opportun
2566,jYk2Vx1z6lk,instant classic,instant classic
2567,jYk2Vx1z6lk,Song in the last scene?,song last scene
2568,jYk2Vx1z6lk,"too much singing, 4/10 - IGN",much sing ign
2569,jYk2Vx1z6lk,Ya think we&#39;d be able to get decent movies but as usual Ireland produces shite.,ya think abl get decent movi usual ireland produc shite
2570,jYk2Vx1z6lk,Sundance 2016!,sundanc
2571,jYk2Vx1z6lk,Song?,song
2572,jYk2Vx1z6lk,What is the song in the last part? so catchy. not darude sandstorm please.,song last part catchi darud sandstorm pleas
2573,jYk2Vx1z6lk,This looks so good!!,look good
2574,jYk2Vx1z6lk,"Of deluge if nostalgia flicks Hollywood is drowning us in, this is the 1st that I honestly think is worth the price of admission.  Looks like a fun time.",delug nostalgia flick hollywood drown us st honestli think worth price admiss look like fun time
2575,jYk2Vx1z6lk,"I&#39;m feeling an Almost Famous level of quality, looking forward to this one.",feel almost famou level qualiti look forward one
2576,jYk2Vx1z6lk,hii,hii
2577,jYk2Vx1z6lk,"Looks quirky, fun and OH MY GOD PETYR BAELISH IS IN IT!",look quirki fun oh god petyr baelish
2578,jYk2Vx1z6lk,What this? The origin of the Beatle.,origin beatl
2579,jYk2Vx1z6lk,"Amazing human-being, next level compliments.",amaz human next level compliment
2580,jYk2Vx1z6lk,I bet this comment won&#39;t get a single like!!!,bet comment get singl like
2581,jYk2Vx1z6lk,I like it,like
2582,jYk2Vx1z6lk,esrly,esrli
2583,jYk2Vx1z6lk,Looks like fun :),look like fun
2584,jYk2Vx1z6lk,it seems like it&#39;s a good family movie.,seem like good famili movi
2585,jYk2Vx1z6lk,so.. the commitments anyone? got that same vibe,commit anyon got vibe
2586,jYk2Vx1z6lk,100th view,th view
2587,6LiKKFZyhRU,can&#39;t wait,wait
2588,6LiKKFZyhRU,"As soon as I saw that woman and saw her cut of the light, I screamed for joy. Becuase I knew exactly who this was. lol Some of the best horror shorts on YouTube. I&#39;m really happy for him.",soon saw woman saw cut light scream joy becuas knew exactli lol best horror short youtub realli happi
2589,6LiKKFZyhRU,"<a href=""http://www.youtube.com/watch?v=6LiKKFZyhRU&amp;t=1m07s"">1:07</a> Made me lose interest completely",made lose interest complet
2590,6LiKKFZyhRU,"All of these stupid horror movies now and days follow the same theme and formula. There&#39;s always at least one kid and at least one woman who interacts with the kid. This is more than likely just going to be PG-13 garbage. I don&#39;t know who really pays to watch these movies at theaters, but you guys are wasting your money. These are probably used as date movies I guess. I wouldn&#39;t know, I haven&#39;t had a girlfriend in ten years (-__-)",stupid horror movi day follow theme formula alway least one kid least one woman interact kid like go pg garbag know realli pay watch movi theater guy wast money probabl use date movi guess know girlfriend ten year
2591,6LiKKFZyhRU,it looks okay. will always prefer the original short flim imo.,look okay alway prefer origin short flim imo
2592,6LiKKFZyhRU,So basically she is like Pride for Full Metal Alchemist:Brotherhood... interesting,basic like pride full metal alchemist brotherhood interest
2593,6LiKKFZyhRU,Did the Black guy just die?,black guy die
2594,6LiKKFZyhRU,so.... is it lit?,lit
2595,6LiKKFZyhRU,And this comes out on my birthday...sigh.,come birthday sigh
2596,6LiKKFZyhRU,Nope I&#39;m good.. Bye.,nope good bye
2597,6LiKKFZyhRU,Hell nah,hell nah
2598,6LiKKFZyhRU,":O AWESOME !!! <a href=""http://www.youtube.com/watch?v=6LiKKFZyhRU&amp;t=0m51s"">0:51</a> Ghost B.C lml",awesom ghost b c lml
2599,6LiKKFZyhRU,YES YES YES YES YES,ye ye ye ye ye
2600,6LiKKFZyhRU,Oh.<br>My.<br>Goodness.,oh good
2601,6LiKKFZyhRU,shd i go 4 dis or con 2?,shd go di con
2602,6LiKKFZyhRU,oh,oh
2603,6LiKKFZyhRU,its must be very nice film,must nice film
2604,6LiKKFZyhRU,"<b><a href=""http://www.youtube.com/watch?v=6LiKKFZyhRU&amp;t=0m46s"">0:46</a></b>",
2605,6LiKKFZyhRU,Creepypastapunch,creepypastapunch
2606,6LiKKFZyhRU,I have been a fan of ponysmasher  for more than a few years now. This makes me really excited. So Thrilled!!,fan ponysmash year make realli excit thrill
2607,6LiKKFZyhRU,OMG,omg
2608,6LiKKFZyhRU,can they not just turn on a light permanently and if it starts turning itself off &#39; just call the electrician&#39;.,turn light perman start turn call electrician
