,ID,comments,cleaned_comments
992,gOW_azQbOjw,"BENJI GOT HIS MASK!<br>@geniusmoviemind for news on <a href=""http://www.youtube.com/results?search_query=%23jessicajones"">#jessicajones</a> <a href=""http://www.youtube.com/results?search_query=%23marvel"">#marvel</a> <a href=""http://www.youtube.com/results?search_query=%23exclusive"">#exclusive</a>",benji got mask geniusmoviemind news jessicajon marvel exclus
993,gOW_azQbOjw,Pure insanity. We need more committed action stars like Tom.,pure insan need commit action star like tom
994,gOW_azQbOjw,"cruise still the best,i dont think younger actors will be able to pull out this one.",cruis still best dont think younger actor abl pull one
995,gOW_azQbOjw,I love Jeremy Renner than Tom Cruise....,love jeremi renner tom cruis
996,gOW_azQbOjw,"<a href=""http://www.youtube.com/watch?v=gOW_azQbOjw&amp;t=2m18s"">2:18</a>.  Shit just got real.",shit got real
997,gOW_azQbOjw,"You can clearly tell Tom Cruise was having a blast hanging off the side of the plane. Hunt is obviously suppose to have a modicum of fear, but the dude can barely contain the excitement on his face.",clearli tell tom cruis blast hang side plane hunt obvious suppos modicum fear dude bare contain excit face
998,gOW_azQbOjw,He&#39;s on the plane. Now what&#39;s the next step of his master plan?,plane next step master plan
999,gOW_azQbOjw,Tom Cruise is the best movie runner.,tom cruis best movi runner
1000,gOW_azQbOjw,Looks terrible.,look terribl
1001,gOW_azQbOjw,wow Epic!!!!,wow epic
1002,gOW_azQbOjw,"Oh man ! <br>Ethan Hunt is back &amp; waaow - What a comeback !!<br>Spellbinding trailer.<br>Tom Cruise - You are just fab.<br>Great to see Luther &amp; Benji too<br>Last time it was Burj Khalifa, this time it&#39;s an airplane. This guy is extraordinary.",oh man ethan hunt back amp waaow comeback spellbind trailer tom cruis fab great see luther amp benji toolast time burj khalifa time airplan guy extraordinari
1003,gOW_azQbOjw,"I am SQUEALING with excitement for this movie!  Can&#39;t wait to see it! Tom Cruise, you&#39;ve done it again.  You&#39;ve managed to blow my mind with just a trailer!!  This looks like its going to be ANOTHER blockbuster and well deserved!  You are far underrated as an exceptional, versatile and well established  actor.",squeal excit movi wait see tom cruis done manag blow mind trailer look like go anoth blockbust well deserv far underr except versatil well establish actor
1004,gOW_azQbOjw,"Pretty solid trailer overall.  Rarely will I go to a movie JUST for one scene.  But if that mid-flight plane scene is as good as I hope it will be, I will pay full price to see that.",pretti solid trailer overal rare go movi one scene mid flight plane scene good hope pay full price see
1005,gOW_azQbOjw,"getting more comedic, thanks to you simon.<br>dont know how to say about it, but ghost protocol was fun..<br><br>ahh, i forgot. bad robot &amp; star trek..",get comed thank simon dont know say ghost protocol fun ahh forgot bad robot amp star trek
1006,gOW_azQbOjw,WOW!!!! HA-HA WOW!!,wow ha ha wow
1007,gOW_azQbOjw,The other door!<br><br>LMAO. I can&#39;t wait to see this on the biggest screen possible.,door lmao wait see biggest screen possibl
1008,gOW_azQbOjw,I&#39;ll be sure to watch in IMAX for that plane scene alone!,sure watch imax plane scene alon
1009,gOW_azQbOjw,"this should be the last one tom an vin are both agin they&#39;re gettin too old for all this, but it lookes dope ima watch it",last one tom vin agin gettin old look dope ima watch
1010,gOW_azQbOjw,The other door!!!,door
1011,gOW_azQbOjw,Movie sponsored by BMW :D,movi sponsor bmw
1012,gOW_azQbOjw,The small details like the plane stunt done by Tom Cruise makes this movie 10x better than unrealistic CGI,small detail like plane stunt done tom cruis make movi x better unrealist cgi
1013,gOW_azQbOjw,so british,british
1014,gOW_azQbOjw,I see BMW has paid for half the movie and that is awesome :),see bmw paid half movi awesom
1015,gOW_azQbOjw,"Damn, and I was so excited that they were going to dissolve the International Monetary Fund.",damn excit go dissolv intern monetari fund
1016,gOW_azQbOjw,"I don&#39;t understand the hate Tom Cruise gets from some people. How many other actors would be willing to hang of the side of a plane... or the tallest building in the world? I&#39;d love his job personally (and his home life flying P-51d&#39;s ;) But I&#39;m thankful he&#39;s willing to go to such lengths, it means we get cool movies every now and then like this. And Oblivion not so long ago which was great.",understand hate tom cruis get peopl mani actor would will hang side plane tallest build world love job person home life fli p thank will go length mean get cool movi everi like oblivion long ago great
1017,gOW_azQbOjw,i hope mib5 is one of the best film for TOM,hope mib one best film tom
1018,gOW_azQbOjw,Tom Cruise + Mission Impossible = Freaking Cool......Waiting fr d movie :-),tom cruis mission imposs freak cool wait fr movi
1019,gOW_azQbOjw,TOM CRUISE IS THE BEST!,tom cruis best
1020,gOW_azQbOjw,Looks awesome,look awesom
1021,gOW_azQbOjw,"Tom Cruise was &quot;underrated&quot; in the last 5-6 years. People and media criticized him and his movies just because of his life. While he gave stellar films like Edge of Tomorrow, Oblivion, Jack Reacher, Valkyrie, and Ghost Protocol.",tom cruis quot underr quot last year peopl media critic movi life gave stellar film like edg tomorrow oblivion jack reacher valkyri ghost protocol
1022,gOW_azQbOjw,"Actually Mission Impossible Released Date In 2015  Christmas But Tom cruise has scared because king khan badshah no 1 khan srk dilwale is coming In christmas so tom scaredly brought to the film into July Release<br>see haters even hollywood starts also scared srk<br> <br>   <a href=""http://www.youtube.com/results?search_query=%23KingKhanRocks"">#KingKhanRocks</a>",actual mission imposs releas date christma tom cruis scare king khan badshah khan srk dilwal come christma tom scaredli brought film juli releasese hater even hollywood start also scare srk kingkhanrock
1023,gOW_azQbOjw,READY OR NOT HERE I COME,readi come
1024,gOW_azQbOjw,Love Benji&#39;s homage to Troll 2! OH MY GOD!!!!!!,love benji homag troll oh god
1025,gOW_azQbOjw,With Ghost Protocol I wished Luther would be on the team. Now this is the ultimate IMF Team finally! I´m excited!!,ghost protocol wish luther would team ultim imf team final excit
1026,gOW_azQbOjw,300th person to watch it,th person watch
1027,gOW_azQbOjw,Tom cruise is back with bang a sureshot success  Is coming,tom cruis back bang sureshot success come
1028,gOW_azQbOjw,"Morrocco. .<br>MI5 This July<br><br><a href=""https://www.youtube.com/watch?v=gOW_azQbOjw"">https://www.youtube.com/watch?v=gOW_azQbOjw</a>",morrocco mi julyhttp www youtub com watch v gow azqbojw
1029,gOW_azQbOjw,Didn&#39;t expect Simon Pegg gets more screen time than Jeremy Renner!,expect simon pegg get screen time jeremi renner
1030,gOW_azQbOjw,53 year old boy in kid&#39;s fantasy movie,year old boy kid fantasi movi
1031,gOW_azQbOjw,I&#39;m only here because of Simon Pegg.,simon pegg
1032,gOW_azQbOjw,LOL @ Benji&#39;s mask being removed,lol benji mask remov
1033,gOW_azQbOjw,"So glad Tom Cruise is back. He is the real action star, he doesn&#39;t need CGI to be awesome. Fuck Robert gay Jr.",glad tom cruis back real action star need cgi awesom fuck robert gay jr
1034,gOW_azQbOjw,So Epic,epic
1035,gOW_azQbOjw,WOWWWWWWW--- AMAZNG,wowwwwwww amazng
1036,gOW_azQbOjw,"Tom Cruise&#39;s stunts are crazy, in a good and awesome way.",tom cruis stunt crazi good awesom way
1037,gOW_azQbOjw,One thing I&#39;ll miss is Paula Patton,one thing miss paula patton
1038,gOW_azQbOjw,"Yeah, Tom Cruise may be mentally weird in his personal life, but he&#39;s an awesome actor and knows how to deliver incredibly entertaining movies.",yeah tom cruis may mental weird person life awesom actor know deliv incred entertain movi
1039,gOW_azQbOjw,hopefully this will be the first 1 billion movie for tom cruise..<br>JUST CAN&#39;T WAIT!!!!,hope first billion movi tom cruis wait
1040,gOW_azQbOjw,Star Wars : Rogue One Nation ?,star war rogu one nation
1041,gOW_azQbOjw,Really awesome!Can&#39;t wait to see this!,realli awesom wait see
1042,gOW_azQbOjw,Finally people are starting to appreciate Tom Cruise once again.,final peopl start appreci tom cruis
1043,gOW_azQbOjw,HOLAY FACK!,holay fack
1044,gOW_azQbOjw,As Benji would say.. OH MY GOD!,benji would say oh god
1045,gOW_azQbOjw,IT LOOKS AWESOME,look awesom
1046,gOW_azQbOjw,EPIC!  Cannot wait.  Tom Cruise... what can you say other than LEGEND.,epic wait tom cruis say legend
1047,gOW_azQbOjw,"Tom Cruise is absolutely INSANE, and I love him for it!!!!",tom cruis absolut insan love
1048,gOW_azQbOjw,First,first
1049,gOW_azQbOjw,"Tom Cruise movies always entertain and this is not going to be the exception, looks even better than Ghost Protocol",tom cruis movi alway entertain go except look even better ghost protocol
1050,gOW_azQbOjw,WOW!!!,wow
1051,gOW_azQbOjw,Can&#39;t wait 😱 It looks insanely good. 👍😍,wait look insan good
1052,gOW_azQbOjw,"Well, I know what I&#39;m doing July 31st!",well know juli st
1053,gOW_azQbOjw,Under the 301 club... feels nice..,club feel nice
1054,gOW_azQbOjw,Looks great!,look great
1055,gOW_azQbOjw,Wow wow WOW!!!!!!👏👏👏 sold take my money!,wow wow wow sold take money
1056,gOW_azQbOjw,can&#39;t wait,wait
1057,gOW_azQbOjw,Wow!!! Scientologists never age.Where do I sign up?,wow scientologist never age sign
1058,gOW_azQbOjw,First to comment on an awesome movie trailer!!!,first comment awesom movi trailer
1059,gOW_azQbOjw,TOM IS BACK !,tom back
1060,-F5WcFPDzko,"Straight Outta Compton - Official Trailer (HD)<br>~.~.~.~.~.~.~.~.~.~.~.~.~.~.~.~.~.~.~.~.~.~.~.<br>YESSSSSSS !   N.W.A.  <a href=""http://www.youtube.com/results?search_query=%23StraightOuttaCompton"">#StraightOuttaCompton</a> - In Theaters August 14th !!! <br>I can&#39;t FU(KING wait, this movie is long overdue.  PE in effect !",straight outta compton offici trailer hd yesssssss n w straightouttacompton theater august th fu king wait movi long overdu pe effect
1061,-F5WcFPDzko,This shit look lame like that biggie movie watered down niggaz,shit look lame like biggi movi water niggaz
1062,-F5WcFPDzko,Ham!,ham
1063,-F5WcFPDzko,Hsjsjwjo<br><br><br><br><br><br><br><br><br><br>,hsjsjwjo
1064,-F5WcFPDzko,Once you get past the obviously bloated fairy tale portion of Ice Cube being &quot;from da streets&quot; this looks like a decent movie,get past obvious bloat fairi tale portion ice cube quot da street quot look like decent movi
1065,-F5WcFPDzko,It&#39;s all about CMW and NWA Compton&#39;s most wanted and nigga&#39;s with attitude CMW was first though in the 80&#39;s then nwa in the90&#39;s,cmw nwa compton want nigga attitud cmw first though nwa
1066,-F5WcFPDzko,Can&#39;t wait<br>,wait
1067,-F5WcFPDzko,What about mc Ren and yella,mc ren yella
1068,-F5WcFPDzko,I love N.W.A&#39;s &quot;Art&quot; and now they have a movie for it :3...,love n w quot art quot movi
1069,-F5WcFPDzko,Anybody else get excited when they heard post tropical,anybodi els get excit heard post tropic
1070,-F5WcFPDzko,its awesome!,awesom
1071,-F5WcFPDzko,"Does anyone know the piano song in the backround <a href=""http://www.youtube.com/watch?v=-F5WcFPDzko&amp;t=1m40s"">1:40</a> - <a href=""http://www.youtube.com/watch?v=-F5WcFPDzko&amp;t=1m60s"">1:60</a>",anyon know piano song backround
1072,-F5WcFPDzko,Fuck Yeah!,fuck yeah
1073,-F5WcFPDzko,"<a href=""http://youtu.be/-F5WcFPDzko?t=1m35s"">1:35</a> looks like tempenny from Gta sa",look like tempenni gta sa
1074,-F5WcFPDzko,F Gary Gray!!!!,f gari gray
1075,-F5WcFPDzko,This is going to be off the chain,go chain
1076,-F5WcFPDzko,Can&#39;t wait,wait
1077,-F5WcFPDzko,What&#39;s the song?,song
1078,-F5WcFPDzko,"I understand why they&#39;re probably just going to focus on Eazy-E, Ice Cuba &amp; Dr. Dre and feature the MC Ren, DJ Yella and DOC as supporting characters, E, Cube and Dre created bigger legacies outside of the NWA, but I feel like they should have bigger roles.",understand probabl go focu eazi e ice cuba amp dr dre featur mc ren dj yella doc support charact e cube dre creat bigger legaci outsid nwa feel like bigger role
1079,-F5WcFPDzko,Watching the video with my beats on&lt;3 M*thafucka,watch video beat lt thafucka
1080,-F5WcFPDzko,Where&#39;s the DOC?,doc
1081,-F5WcFPDzko,&quot;You are now about to witness the strength of street knowledge&quot;,quot wit strength street knowledg quot
1082,-F5WcFPDzko,My friend will love this movie<br>Cant wait,friend love moviec wait
1083,-F5WcFPDzko,Arabian Prince?,arabian princ
1084,-F5WcFPDzko,"ayyyyeeeee my favorite part of the movie <a href=""http://www.youtube.com/watch?v=-F5WcFPDzko&amp;t=2m18s"">2:18</a>   Eazy E, ICE CUBE, yall are looking at the greatest people alive......",ayyyyeeee favorit part movi eazi e ice cube yall look greatest peopl aliv
1085,-F5WcFPDzko,i cant wait :),cant wait
1086,-F5WcFPDzko,Anybody know what that piano music from the middle to the end is?,anybodi know piano music middl end
1087,-F5WcFPDzko,This eazy voice is way off when he sings boyz in the hood......And his voice is off all together,eazi voic way sing boyz hood voic togeth
1088,-F5WcFPDzko,What was mc ren never in nwa wtf  no mention,mc ren never nwa wtf mention
1089,-F5WcFPDzko,That dosent look like dr dre&#39;s eyes,dosent look like dr dre eye
1090,-F5WcFPDzko,I was NOT expecting this movie to look as amazing as it did. Very exited to see the final result.,expect movi look amaz exit see final result
1091,-F5WcFPDzko,so excited!!can&#39;t wait to see this,excit wait see
1092,-F5WcFPDzko,WHERE CAN I FIND THE PIANO VERSION?!?!,find piano version
1093,-F5WcFPDzko,I wasn&#39;t even raised or like around should i say when NWA was booming. But i saw this trailer when i went to see Furious 7 &amp; I CAN&#39;T wait... &#39;&#39;CRUSIN&#39; DOWN THE STREET IN MY SIX FOE&#39;&#39;,even rais like around say nwa boom saw trailer went see furiou amp wait crusin street six foe
1094,-F5WcFPDzko,Do they have the music from these trailer out and no not the original sounds track.i mean the one from these trailer.,music trailer origin sound track mean one trailer
1095,-F5WcFPDzko,Imma watch this. Fuh sho.,imma watch fuh sho
1096,-F5WcFPDzko,Where are MC Ren and Yella ?,mc ren yella
1097,-F5WcFPDzko,Fucking cops man.,fuck cop man
1098,-F5WcFPDzko,its by time!!,time
1099,-F5WcFPDzko,EAZY EEEEEEE MDFK!,eazi eeeeeee mdfk
1100,-F5WcFPDzko,Yo ain&#39;t easy-e from gta San Andreas ? Idk I might be wrong,yo easi e gta san andrea idk might wrong
1101,-F5WcFPDzko,NWA Fan Fo&#39; Life....I can&#39;t fucking wait until this movie comes out....,nwa fan fo life fuck wait movi come
1102,-F5WcFPDzko,Fuck Tupac bring back eazy,fuck tupac bring back eazi
1103,-F5WcFPDzko,my nigga!,nigga
1104,-F5WcFPDzko,"nice, tupac next lol<br>cant help it",nice tupac next lolcant help
1105,-F5WcFPDzko,This movie looks so good,movi look good
1106,-F5WcFPDzko,so excited u do not understand,excit u understand
1107,-F5WcFPDzko,Ok; I have to go watch this movie.... I swear this could be the shit.......,ok go watch movi swear could shit
1108,-F5WcFPDzko,My life is complete.  This movie is perfect.,life complet movi perfect
1109,-F5WcFPDzko,Fuck yeah,fuck yeah
1110,-F5WcFPDzko,This movie is gonna be so raw,movi gon na raw
1111,-F5WcFPDzko,OH SHIT,oh shit
1112,-F5WcFPDzko,"Yet look at Ice Cube now, what a clown, it&#39;s over now.",yet look ice cube clown
1113,-F5WcFPDzko,This movie is gonna be awesome,movi gon na awesom
1114,-F5WcFPDzko,I just want to know who directed this movie? Was it Dr.Dre or Jimmy Lovine.,want know direct movi dr dre jimmi lovin
1115,-F5WcFPDzko,"this some fake ass corporate bullshit.  everything NWA were, this movie is not.",fake ass corpor bullshit everyth nwa movi
1116,-F5WcFPDzko,Where&#39;s REN!!!! He wrote most of eazy first album which open the door for nwa.,ren wrote eazi first album open door nwa
1117,-F5WcFPDzko,I barely need to watch this cause I know every thing about it,bare need watch caus know everi thing
1118,-F5WcFPDzko,"Hopefully this not becomes a dre, cube,  eazy movie. DJ Yella, MC Ren also were part of n.w.a., the D.O.C. also worked alot with them, but from what it looks like they don&#39;t even mention the Arabian Prince as well.",hope becom dre cube eazi movi dj yella mc ren also part n w c also work alot look like even mention arabian princ well
1119,-F5WcFPDzko,Deal with it!! Korean Hip-Hop Punks!,deal korean hip hop punk
1120,-F5WcFPDzko,I could either see fast 7 or NWA I chose NWA,could either see fast nwa chose nwa
1121,-F5WcFPDzko,"They should&#39;ve have used lil Eazy to play Eazy E, it&#39;s only fair if they used ice cube son to portray him",use lil eazi play eazi e fair use ice cube son portray
1122,-F5WcFPDzko,if Hollywood get its hands on it its 50/50 B.S. and truth. Everybody putting cut in the work these days. Nuthin real,hollywood get hand b truth everybodi put cut work day nuthin real
1123,-F5WcFPDzko,WhERE IS MC REN???<br><br>OR MY NIGGA DJ YELLA<br>THEY&#39;RE FIVE MEMBERS OF NWA<br><br>ONLY THREE GOT REALLY BIG BUT STILL,mc ren nigga dj yellathey five member nwaonli three got realli big still
1124,-F5WcFPDzko,Can&#39;t wait,wait
1125,-F5WcFPDzko,And  to  the people in  México waht !!?? .....  :(,peopl xico waht
1126,-F5WcFPDzko,hell yeah,hell yeah
1127,-F5WcFPDzko,Oh shit Eazy vs Suge Knight,oh shit eazi vs suge knight
1128,-F5WcFPDzko,Ice Cube was the man. I don&#39;t care if he makes a thousand shitty kids films nowadays. He was still the man *.<br>* (Even if rap itself was invented by Bowie in 1979).,ice cube man care make thousand shitti kid film nowaday still man even rap invent bowi
1129,-F5WcFPDzko,"NWA 4 ever!!!... To be honest: PUBLIC ENEMY was the most dangerous group, for real -- but, we&#39;ll never see a PE movie... If NWA was a real threat for The System, they would NOT allow this kinda movie to be made. Think &#39;bout it.",nwa ever honest public enemi danger group real never see pe movi nwa real threat system would allow kinda movi made think bout
1130,-F5WcFPDzko,I can&#39;t fucking wait,fuck wait
1131,-F5WcFPDzko,"Without eazy nwa wouldn&#39;t be around nor would dre nor would cube nor would snoop nor would eminem nor would death row nor would 2Pac, just cause he eazy didn&#39;t write his music while in NWA doesnt mean he was shit. He had a great voice and was a natural rapper once he got the hang of it.",without eazi nwa around would dre would cube would snoop would eminem would death row would pac caus eazi write music nwa doesnt mean shit great voic natur rapper got hang
1132,-F5WcFPDzko,"Lookin&#39; like you did NWA&#39;s story justice and didn&#39;t slack off just to make money off them. Still, If it&#39;s not rated &quot;R&quot; I&#39;m not going to see it b/c their story was not PG-13 or less. We&#39;ll see.",lookin like nwa stori justic slack make money still rate quot r quot go see b c stori pg less see
1133,-F5WcFPDzko,Jizz in my pants,jizz pant
1134,-F5WcFPDzko,YEAAAAH!!!,yeaaaah
1135,-F5WcFPDzko,Real shit loving everything i have seen...but where is ren? Yella? D.o.c.?,real shit love everyth seen ren yella c
1136,-F5WcFPDzko,"Hoepfully I see dr dre as a dancer, and ice cube writing boyz n the hood. If they gone be real be all the way real.",hoep see dr dre dancer ice cube write boyz n hood gone real way real
1137,-F5WcFPDzko,Get your Raiders hats!!!!,get raider hat
1138,-F5WcFPDzko,and mc ren??,mc ren
1139,-F5WcFPDzko,I wish Eazy was here to put his input into the movie and not his fucking widow Tomica.  😒,wish eazi put input movi fuck widow tomica
1140,-F5WcFPDzko,shit looks dope!,shit look dope
1141,-F5WcFPDzko,&quot;Our art is a reflection of our reality&quot;,quot art reflect realiti quot
1142,-F5WcFPDzko,"sure i not gonna take my wallet on the theater to watch this movie, what could go wrong without it<br>* bang bang bang * dead",sure gon na take wallet theater watch movi could go wrong without bang bang bang dead
1143,-F5WcFPDzko,Ждем!!!!!!,
1144,-F5WcFPDzko,Furious 7,furiou
1145,-F5WcFPDzko,I dont see no Dre or ice cube,dont see dre ice cube
1146,-F5WcFPDzko,The movie willbe dope......BUT WAT BOUT ARABIAN PRINCE?,movi willb dope wat bout arabian princ
1147,-F5WcFPDzko,MC REN LOOKING LIKE A STRETCHED TBONE BISCUIT,mc ren look like stretch tbone biscuit
1148,-F5WcFPDzko,"Mean, this gona be good...",mean gona good
1149,-F5WcFPDzko,Dope!!!,dope
1150,-F5WcFPDzko,Respect from Colombia,respect colombia
1151,-F5WcFPDzko,Piano version... nice!,piano version nice
1152,-F5WcFPDzko,Can&#39;t wait,wait
1153,-F5WcFPDzko,yeah,yeah
1154,-F5WcFPDzko,This movie looks dope lookin&#39; forward 2 it...bruh,movi look dope lookin forward bruh
1155,-F5WcFPDzko,хуй бомжа,
1156,-F5WcFPDzko,It looks good.,look good
1157,-F5WcFPDzko,Fuck The Police!!,fuck polic
1158,-F5WcFPDzko,Siii,siii
1159,-F5WcFPDzko,"Speak a little truth and people lose their mind. Check out the new trailer for <a href=""http://www.youtube.com/results?search_query=%23StraightOuttaCompton"">#StraightOuttaCompton</a> - In Theaters August 14th.",speak littl truth peopl lose mind check new trailer straightouttacompton theater august th
1160,ltijEmlyqlg,Why don&#39;t I find her funny,find funni
1161,ltijEmlyqlg,(sees bomb) Looks like a garbage disposal,see bomb look like garbag dispos
1162,ltijEmlyqlg,"OK I laughed more than seven times, this is a must see.",ok laugh seven time must see
1163,ltijEmlyqlg,I&#39;m so excited. She&#39;s my favourite actress.,excit favourit actress
1164,ltijEmlyqlg,I love Melissa McCarthy!,love melissa mccarthi
1165,ltijEmlyqlg,Come talking I&#39;m bored,come talk bore
1166,ltijEmlyqlg,Can I have like for nothing,like noth
1167,ltijEmlyqlg,this movies looks freakin hilarious,movi look freakin hilari
1168,ltijEmlyqlg,you gonna cry ?? haahaahahahaahaa,gon na cri haahaahahahaahaa
1169,ltijEmlyqlg,eww Melissa McCarthy,eww melissa mccarthi
1170,ltijEmlyqlg,"&quot;Ok lunch lady, yeah bring one of yours cats as a side kick &quot; Cant stop laughing! !!",quot ok lunch ladi yeah bring one cat side kick quot cant stop laugh
1171,ltijEmlyqlg,LMFAO!!!,lmfao
1172,ltijEmlyqlg,haha..cant wait...love the scooter part,haha cant wait love scooter part
1173,ltijEmlyqlg,this looks like garbage,look like garbag
1174,ltijEmlyqlg,It&#39;s really great to see her do something different and not play the same old goofy idiot again. -__-,realli great see someth differ play old goofi idiot
1175,ltijEmlyqlg,nope. too fat,nope fat
1176,ltijEmlyqlg,Jason Statham All the way!! ..my idol!,jason statham way idol
1177,ltijEmlyqlg,I want to watch this so much!,want watch much
1178,ltijEmlyqlg,"Havent seen any backstabs, where r the backstabs?",havent seen backstab r backstab
1179,ltijEmlyqlg,&quot;get in sports car&quot;,quot get sport car quot
1180,ltijEmlyqlg,This looks bloody amazing!!!,look bloodi amaz
1181,ltijEmlyqlg,I&#39;ll pass.,pass
1183,ltijEmlyqlg,it s funny because she fat . hahaha. Im sorry this is a really bad comment. I just want to quote Chow lol,funni fat hahaha im sorri realli bad comment want quot chow lol
1184,ltijEmlyqlg,lol this is so funny,lol funni
1185,ltijEmlyqlg,somewhere deep (dj rapist and Dj Venomous Extended Mix),somewher deep dj rapist dj venom extend mix
1186,ltijEmlyqlg,WHY IS IT R RATED!!!???? AGHH I HATE THIS. ITS HARD BEING A TEENAGER..,r rate aghh hate hard teenag
1187,ltijEmlyqlg,I saw the premiere if the movie at SXSW and it was incredible! Funniest movie I&#39;ve seen in a long time! And it has an all star cast too!,saw premier movi sxsw incred funniest movi seen long time star cast
1188,ltijEmlyqlg,Goddammmm! Gonna see this one!,goddammmm gon na see one
1189,ltijEmlyqlg,Hey peeps sorry for this comment not having anything to do with the vid but i have some incredible news. Did you know you could get anything from Amazon for absolutely nothing!? I kid you not. There&#39;s a site you can go to get any product from Amazon without paying a dime!. That includes anything from any category including Gift cards.,hey peep sorri comment anyth vid incred news know could get anyth amazon absolut noth kid site go get product amazon without pay dime includ anyth categori includ gift card
1190,ltijEmlyqlg,hopefully its not another tammy,hope anoth tammi
1191,ltijEmlyqlg,روائع,
1192,ltijEmlyqlg,"Nawt the cah, I, was awn fiyah.",nawt cah awn fiyah
1193,ltijEmlyqlg,"went to the pre screening, FUNNY AF&lt; HIGHLY RECOMMEND THIS!!!!! Great work FOX",went pre screen funni af lt highli recommend great work fox
1194,ltijEmlyqlg,why did the scooter have no roof then a roof?,scooter roof roof
1195,ltijEmlyqlg,I think they&#39;re putting too much thought into these movie titles.,think put much thought movi titl
1196,ltijEmlyqlg,"Seems like a funny movie. This over-weight woman is like a feminine version of that over-weight man in Anger Management. Sorry, I don&#39;t know their names...",seem like funni movi weight woman like feminin version weight man anger manag sorri know name
1197,ltijEmlyqlg,great cast,great cast
1198,ltijEmlyqlg,Looks awesome! I dont say that about many movies these days..,look awesom dont say mani movi day
1199,ltijEmlyqlg,not the car i was on fire,car fire
1200,ltijEmlyqlg,"eurghh, hate this actress.",eurghh hate actress
1201,ltijEmlyqlg,I don&#39;t know what to expect.<br><br>But it&#39;s got Miranda and Jason Statham in it - so anything could happen.,know expect got miranda jason statham anyth could happen
1202,ltijEmlyqlg,Got see this one.. looks funny!,got see one look funni
1203,ltijEmlyqlg,I can&#39;t stand Melissa McCarthy bit ill see this for Jason,stand melissa mccarthi bit ill see jason
1204,ltijEmlyqlg,miss Jude Law...,miss jude law
1205,ltijEmlyqlg,this look very funny.. but i think they just put all the jokes on the trailer,look funni think put joke trailer
